{
  "schema_version": "1.0.0",
  "request_ref": "req_support_001",
  "tenant_id": "tenant_demo",
  "correlation_id": "cor_support_001",
  "source_ref": "source_support_fixture",
  "received_at": "2026-05-18T09:15:00Z",
  "intake_channel_category": "api_fixture",
  "account_ref": "acct_demo_001",
  "product_ref": "prod_core_platform",
  "case_ref": "case_existing_001",
  "severity_hint_category": "sev_high",
  "request_status_category": "new",
  "redacted_summary_ref": "summary_support_001",
  "attachment_refs": [
    "att_support_safe_001"
  ],
  "idempotency_ref": "idem_support_intake_001",
  "routing_policy_ref": "policy_support_triage_intake"
}
